<?xml version="1.0" encoding="utf-8" ?>
<Computer
        xmlns="http://tempuri.org/Computer.xsd"
        xmlns:xsi="http://www.w3.org/2001/XMLSchema-instance"
        xsi:noNamespaceSchemaLocation="computer.xsd">

  <Name>MAC</Name>
  <Origin>USA</Origin>
  <Price>2500</Price>
  <IsCritical>true</IsCritical>
  <Type>
    <IsPeripheral>false</IsPeripheral>
    <EnergyConsumption>90</EnergyConsumption>
    <HasCooler>true</HasCooler>
    <TypeGroup>Multimedia</TypeGroup>
    <Port>USB</Port>
  </Type>
</Computer>
